{
  "source": {
    "rawg": {
      "game": "Far Cry 5",
      "source": "rawg",
      "fetched_at": "2025-11-25T09:19:56.953596Z",
      "count": 1,
      "records": [
        {
          "id": 23585,
          "slug": "far-cry-5",
          "name": "Far Cry 5",
          "name_original": "Far Cry 5",
          "description": "<p>Far Cry 5 is an open-world adventure first-person shooter developed by Ubisoft Montreal. It is the fifth main installment in the series.</p>\n<p>Welcome to Hope County, Montana, where a violent religious doomsday cult appeared. You play as a junior deputy sheriff who gets trapped in the Hope County as all the ways out the county are now patrolled with cultists and all external communication is cut off. It is your job to free the county of cultists.</p>\n<p>For the first time in the series, the game features a character creation screen. A wide range of weaponry which varies from pistols to grenade launchers is available to the player. Various vehicles are also at your exposal: cars, planes, helicopters, and so on. </p>\n<p>The game puts a strong emphasis on building the resistance to the cultists. Players have to recruit the locals in order to have more fighters and gain reputation.</p>\n<p>A welcome addition to the game is the so-called Guns For Hire system. It allows the players to choose one of the comrades that will follow them anywhere. For example, hiring a sniper will help the player spot enemy targets in the distance.</p>\n<p>The whole game can be played in both singleplayer and co-op modes.</p>",
          "metacritic": 80,
          "metacritic_platforms": [
            {
              "metascore": 82,
              "url": "https://www.metacritic.com/game/xbox-one/far-cry-5",
              "platform": {
                "platform": 1,
                "name": "Xbox One",
                "slug": "xbox-one"
              }
            },
            {
              "metascore": 78,
              "url": "https://www.metacritic.com/game/pc/far-cry-5",
              "platform": {
                "platform": 4,
                "name": "PC",
                "slug": "pc"
              }
            },
            {
              "metascore": 81,
              "url": "https://www.metacritic.com/game/playstation-4/far-cry-5",
              "platform": {
                "platform": 18,
                "name": "PlayStation 4",
                "slug": "playstation4"
              }
            }
          ],
          "released": "2018-03-27",
          "tba": false,
          "updated": "2025-11-22T09:04:51",
          "website": "https://www.ubisoft.com/en-gb/game/far-cry/far-cry-5",
          "rating": 3.72,
          "rating_top": 4,
          "ratings": [
            {
              "id": 4,
              "title": "recommended",
              "count": 1180,
              "percent": 53.86
            },
            {
              "id": 3,
              "title": "meh",
              "count": 573,
              "percent": 26.15
            },
            {
              "id": 5,
              "title": "exceptional",
              "count": 319,
              "percent": 14.56
            },
            {
              "id": 1,
              "title": "skip",
              "count": 119,
              "percent": 5.43
            }
          ],
          "reactions": {
            "1": 5,
            "2": 2,
            "3": 4,
            "4": 2,
            "5": 1,
            "6": 2,
            "7": 5,
            "8": 8,
            "9": 2,
            "10": 4,
            "12": 3,
            "14": 5,
            "15": 6,
            "16": 6,
            "20": 2,
            "21": 2
          },
          "added": 8432,
          "added_by_status": {
            "yet": 397,
            "owned": 4741,
            "beaten": 1883,
            "toplay": 626,
            "dropped": 603,
            "playing": 182
          },
          "playtime": 19,
          "creators_count": 8,
          "achievements_count": 435,
          "parent_achievements_count": 66,
          "reddit_url": "https://www.reddit.com/r/farcry/",
          "reddit_name": "",
          "reddit_description": "",
          "reddit_count": 11460,
          "twitch_count": 113,
          "youtube_count": 1000000,
          "reviews_text_count": 42,
          "ratings_count": 2149,
          "suggestions_count": 401,
          "alternative_names": [],
          "metacritic_url": "https://www.metacritic.com/game/playstation-4/far-cry-5",
          "parents_count": 0,
          "additions_count": 4,
          "game_series_count": 7,
          "user_game": null,
          "reviews_count": 2191,
          "saturated_color": "0f0f0f",
          "dominant_color": "0f0f0f",
          "parent_platforms": [
            {
              "platform": {
                "id": 1,
                "name": "PC",
                "slug": "pc"
              }
            },
            {
              "platform": {
                "id": 2,
                "name": "PlayStation",
                "slug": "playstation"
              }
            },
            {
              "platform": {
                "id": 3,
                "name": "Xbox",
                "slug": "xbox"
              }
            }
          ],
          "platforms": [
            {
              "platform": {
                "id": 18,
                "name": "PlayStation 4",
                "slug": "playstation4",
                "year_end": null,
                "year_start": null,
                "games_count": 6951
              },
              "released_at": "2018-03-27",
              "requirements": {}
            },
            {
              "platform": {
                "id": 4,
                "name": "PC",
                "slug": "pc",
                "year_end": null,
                "year_start": null,
                "games_count": 559861
              },
              "released_at": "2018-03-27",
              "requirements": {}
            },
            {
              "platform": {
                "id": 1,
                "name": "Xbox One",
                "slug": "xbox-one",
                "year_end": null,
                "year_start": null,
                "games_count": 5714
              },
              "released_at": "2018-03-27",
              "requirements": {}
            }
          ],
          "stores": [
            {
              "id": 27680,
              "url": "",
              "store": {
                "id": 1,
                "name": "Steam",
                "slug": "steam",
                "domain": "store.steampowered.com",
                "games_count": 122741
              }
            },
            {
              "id": 27693,
              "url": "",
              "store": {
                "id": 3,
                "name": "PlayStation Store",
                "slug": "playstation-store",
                "domain": "store.playstation.com",
                "games_count": 8062
              }
            },
            {
              "id": 27695,
              "url": "",
              "store": {
                "id": 2,
                "name": "Xbox Store",
                "slug": "xbox-store",
                "domain": "microsoft.com",
                "games_count": 4930
              }
            }
          ],
          "developers": [
            {
              "id": 405,
              "name": "Ubisoft",
              "slug": "ubisoft",
              "games_count": 349
            },
            {
              "id": 3709,
              "name": "Ubisoft Montreal",
              "slug": "ubisoft-montreal",
              "games_count": 121
            },
            {
              "id": 4415,
              "name": "Ubisoft Toronto",
              "slug": "ubisoft-toronto",
              "games_count": 13
            },
            {
              "id": 13633,
              "name": "Ubisoft Shanghai",
              "slug": "ubisoft-shanghai-2",
              "games_count": 26
            },
            {
              "id": 6164,
              "name": "Ubisoft Kiev",
              "slug": "ubisoft-kiev",
              "games_count": 7
            },
            {
              "id": 13632,
              "name": "Red Storm",
              "slug": "red-storm",
              "games_count": 30
            }
          ],
          "genres": [
            {
              "id": 4,
              "name": "Action",
              "slug": "action",
              "games_count": 191231
            },
            {
              "id": 2,
              "name": "Shooter",
              "slug": "shooter",
              "games_count": 59606
            }
          ],
          "tags": [
            {
              "id": 31,
              "name": "Singleplayer",
              "slug": "singleplayer",
              "language": "eng",
              "games_count": 250424
            },
            {
              "id": 7,
              "name": "Multiplayer",
              "slug": "multiplayer",
              "language": "eng",
              "games_count": 42472
            },
            {
              "id": 13,
              "name": "Atmospheric",
              "slug": "atmospheric",
              "language": "eng",
              "games_count": 39608
            },
            {
              "id": 7808,
              "name": "steam-trading-cards",
              "slug": "steam-trading-cards",
              "language": "eng",
              "games_count": 7568
            },
            {
              "id": 18,
              "name": "Co-op",
              "slug": "co-op",
              "language": "eng",
              "games_count": 14342
            },
            {
              "id": 118,
              "name": "Story Rich",
              "slug": "story-rich",
              "language": "eng",
              "games_count": 27182
            },
            {
              "id": 36,
              "name": "Open World",